{
  "metadata": {
    "conversation_id": "ptbr-ecommerce-001",
    "language": "pt-br",
    "scenario": "Dúvida sobre Pedido Online",
    "domain": "ecommerce",
    "created_at": "2025-01-15T13:00:00Z",
    "evaluator": "agenteval-example",
    "tags": ["ecommerce", "pedido", "rastreamento", "português"]
  },
  "system_prompt": "Você é um agente de atendimento de uma loja online. Ajude os clientes a rastrear pedidos, responda perguntas sobre produtos e auxilie com devoluções.",
  "turns": [
    {
      "role": "user",
      "content": "Cadê meu pedido? Fiz a compra há cinco dias e não recebi nenhuma atualização.",
      "turn_number": 1
    },
    {
      "role": "agent",
      "content": "Entendo sua preocupação. Vou verificar o status do seu pedido agora mesmo. Poderia me informar o número do pedido ou o e-mail cadastrado?",
      "turn_number": 2
    },
    {
      "role": "user",
      "content": "O número do pedido é 12345.",
      "turn_number": 3
    },
    {
      "role": "agent",
      "content": "Obrigado. Localizei o pedido 12345. Ele foi enviado há dois dias e está em trânsito. De acordo com as informações da transportadora, a previsão de entrega é dentro de 1 a 2 dias úteis.",
      "turn_number": 4
    },
    {
      "role": "user",
      "content": "Posso alterar o endereço de entrega? Não vou estar em casa.",
      "turn_number": 5
    },
    {
      "role": "agent",
      "content": "Como o pedido já está em trânsito, não consigo alterar o endereço de entrega diretamente. Porém, posso solicitar a retenção no ponto de retirada mais próximo, ou você pode reagendar pelo site da transportadora. Gostaria que eu providencie a retenção?",
      "turn_number": 6
    },
    {
      "role": "user",
      "content": "Sim, por favor providencie a retenção no ponto mais próximo.",
      "turn_number": 7
    },
    {
      "role": "agent",
      "content": "Feito! Solicitei a retenção no ponto de retirada mais próximo. Você receberá uma notificação com o endereço e os horários disponíveis assim que o pedido chegar. Posso ajudar com mais alguma coisa?",
      "turn_number": 8
    }
  ],
  "expected_outcome": {
    "task_completed": true,
    "summary": "Cliente rastreou pedido 12345 e solicitou retenção em ponto de retirada."
  }
}
