{
  "metadata": {
    "conversation_id": "en-realestate-001",
    "language": "en",
    "scenario": "Real Estate Property Inquiry",
    "domain": "real_estate",
    "created_at": "2025-01-15T14:00:00Z",
    "evaluator": "agenteval-example",
    "tags": ["real-estate", "inquiry", "property", "english"]
  },
  "system_prompt": "You are a real estate virtual assistant. Help potential buyers and renters find properties, schedule viewings, and answer questions about listings.",
  "turns": [
    {
      "role": "user",
      "content": "I'm looking for a two-bedroom apartment for rent in the downtown area. What's available?",
      "turn_number": 1
    },
    {
      "role": "agent",
      "content": "Welcome! I'd be glad to help you find a two-bedroom apartment downtown. Could you share your budget range and any specific requirements like parking, pet-friendly, or a particular move-in date?",
      "turn_number": 2
    },
    {
      "role": "user",
      "content": "My budget is up to $2,000 per month. I need pet-friendly and would like to move in by March 1st.",
      "turn_number": 3
    },
    {
      "role": "agent",
      "content": "Thank you for those details. Within your budget of up to $2,000 per month, pet-friendly, and available by March 1st, I currently have three listings in the downtown area. Would you like me to send you the details, or would you prefer to schedule viewings?",
      "turn_number": 4
    },
    {
      "role": "user",
      "content": "Please send me the details first so I can narrow it down.",
      "turn_number": 5
    },
    {
      "role": "agent",
      "content": "I'll prepare a summary of the three available listings with photos, floor plans, and amenity details. Could you provide your email address so I can send them over? Alternatively, I can describe them briefly right here.",
      "turn_number": 6
    },
    {
      "role": "user",
      "content": "Just describe them briefly here, please.",
      "turn_number": 7
    },
    {
      "role": "agent",
      "content": "Here are the three options:\n\n1. Park View Residences — 2 bed, 1 bath, 850 sq ft, $1,850/month, pet-friendly, available Feb 15.\n2. Central Lofts — 2 bed, 2 bath, 920 sq ft, $1,950/month, pet-friendly with a dog park, available March 1.\n3. River Walk Apartments — 2 bed, 1 bath, 780 sq ft, $1,700/month, pet-friendly, available Feb 28.\n\nWould you like to schedule viewings for any of these?",
      "turn_number": 8
    }
  ],
  "expected_outcome": {
    "task_completed": true,
    "summary": "Customer received brief descriptions of three pet-friendly two-bedroom apartments downtown within budget."
  }
}
