{
  "metadata": {
    "conversation_id": "en-receptionist-001",
    "language": "en",
    "scenario": "General Receptionist",
    "domain": "receptionist",
    "created_at": "2025-01-15T15:00:00Z",
    "evaluator": "agenteval-example",
    "tags": ["receptionist", "general", "information", "english"]
  },
  "system_prompt": "You are a virtual receptionist for a multi-service business center. Help visitors with directions, schedules, and general inquiries.",
  "turns": [
    {
      "role": "user",
      "content": "Hello, I have a meeting with the accounting department at 2 PM. Where should I go?",
      "turn_number": 1
    },
    {
      "role": "agent",
      "content": "Hello! Welcome to the business center. The accounting department is located on the third floor, suite 305. You can take the elevator on your left or use the staircase at the end of the hallway. Would you like me to notify them that you've arrived?",
      "turn_number": 2
    },
    {
      "role": "user",
      "content": "Yes, please let them know. My name is Sam Parker.",
      "turn_number": 3
    },
    {
      "role": "agent",
      "content": "I've notified the accounting department that Sam Parker has arrived for the 2 PM meeting. They'll be expecting you in suite 305. Is there anything else you need — perhaps directions to the restroom or the coffee area?",
      "turn_number": 4
    },
    {
      "role": "user",
      "content": "Actually, where is the coffee area?",
      "turn_number": 5
    },
    {
      "role": "agent",
      "content": "The coffee area is on the ground floor, just past the reception desk on the right side. It's open to all visitors and has complimentary coffee, tea, and water. You're welcome to grab something before heading up to your meeting.",
      "turn_number": 6
    },
    {
      "role": "user",
      "content": "Great, thank you!",
      "turn_number": 7
    },
    {
      "role": "agent",
      "content": "You're welcome, Sam! Enjoy your coffee and have a productive meeting. Don't hesitate to ask if you need anything else.",
      "turn_number": 8
    }
  ],
  "expected_outcome": {
    "task_completed": true,
    "summary": "Visitor was directed to the accounting department, staff was notified, and coffee area directions were provided."
  }
}
