{
  "metadata": {
    "conversation_id": "en-ecommerce-001",
    "language": "en",
    "scenario": "E-commerce Order Question",
    "domain": "ecommerce",
    "created_at": "2025-01-15T13:00:00Z",
    "evaluator": "agenteval-example",
    "tags": ["ecommerce", "order", "tracking", "english"]
  },
  "system_prompt": "You are an e-commerce customer service agent. Help customers track orders, answer product questions, and assist with returns.",
  "turns": [
    {
      "role": "user",
      "content": "Where is my order? I placed it five days ago and haven't received any updates.",
      "turn_number": 1
    },
    {
      "role": "agent",
      "content": "I understand your concern. I'd be happy to check the status of your order. Could you please share your order number or the email address associated with the account?",
      "turn_number": 2
    },
    {
      "role": "user",
      "content": "The order number is 54321.",
      "turn_number": 3
    },
    {
      "role": "agent",
      "content": "Thank you. I've found order 54321. It was shipped two days ago and is currently in transit. Based on the carrier information, it should arrive within the next 1-2 business days.",
      "turn_number": 4
    },
    {
      "role": "user",
      "content": "Can I change the delivery address? I won't be home.",
      "turn_number": 5
    },
    {
      "role": "agent",
      "content": "Since the order is already in transit, I'm not able to change the delivery address directly. However, I can request a hold at the nearest pickup point, or you can reschedule delivery through the carrier's website. Would you like me to arrange the pickup hold?",
      "turn_number": 6
    },
    {
      "role": "user",
      "content": "Yes, please arrange the pickup hold. That works for me.",
      "turn_number": 7
    },
    {
      "role": "agent",
      "content": "I've submitted the request for a pickup hold at the nearest location. You'll receive a notification with the pickup address and available hours once it arrives. Is there anything else I can help you with?",
      "turn_number": 8
    }
  ],
  "expected_outcome": {
    "task_completed": true,
    "summary": "Customer tracked order 54321 and arranged a pickup hold since the delivery address couldn't be changed."
  }
}
