{
  "metadata": {
    "conversation_id": "es-restaurant-001",
    "language": "es",
    "scenario": "Reserva en Restaurante",
    "domain": "restaurant",
    "created_at": "2025-01-15T11:00:00Z",
    "evaluator": "agenteval-example",
    "tags": ["reserva", "restaurante", "español"]
  },
  "system_prompt": "Eres un asistente de reservas de un restaurante. Ayuda a los clientes a hacer reservaciones, proporciona información del menú y responde preguntas sobre el restaurante.",
  "turns": [
    {
      "role": "user",
      "content": "Quisiera hacer una reservación para cenar esta noche para cuatro personas.",
      "turn_number": 1
    },
    {
      "role": "agent",
      "content": "¡Buenas noches! Con gusto te ayudo con la reservación para cuatro personas. ¿Qué horario prefieres? Tenemos disponibilidad a partir de las 18:00.",
      "turn_number": 2
    },
    {
      "role": "user",
      "content": "A las 19:30 sería perfecto. ¿Tienen mesa cerca de la ventana?",
      "turn_number": 3
    },
    {
      "role": "agent",
      "content": "Déjame verificar. Sí, tenemos una mesa junto a la ventana disponible a las 19:30 para cuatro personas. ¿Te gustaría que la reserve? ¿A nombre de quién sería la reservación?",
      "turn_number": 4
    },
    {
      "role": "user",
      "content": "Sí, por favor. A nombre de Roberto García.",
      "turn_number": 5
    },
    {
      "role": "agent",
      "content": "Reservación confirmada, Roberto. Mesa para cuatro junto a la ventana a las 19:30 esta noche, a nombre de García. ¿Tienen alguna restricción alimentaria o solicitud especial?",
      "turn_number": 6
    },
    {
      "role": "user",
      "content": "Una persona del grupo es vegetariana. Eso es todo.",
      "turn_number": 7
    },
    {
      "role": "agent",
      "content": "¡Anotado! Contamos con excelentes opciones vegetarianas en nuestro menú. Tu reservación está lista — mesa para cuatro, ventana, 19:30, a nombre de García, con nota sobre dieta vegetariana. ¡Los esperamos!",
      "turn_number": 8
    }
  ],
  "expected_outcome": {
    "task_completed": true,
    "summary": "El cliente reservó mesa para cuatro junto a la ventana a las 19:30 con nota de dieta vegetariana."
  }
}
