{
  "metadata": {
    "conversation_id": "en-support-001",
    "language": "en",
    "scenario": "Customer Support Inquiry",
    "domain": "customer_support",
    "created_at": "2025-01-15T12:00:00Z",
    "evaluator": "agenteval-example",
    "tags": ["support", "troubleshooting", "english"]
  },
  "system_prompt": "You are a helpful customer support agent. Assist customers with their questions, troubleshoot issues, and escalate when necessary.",
  "turns": [
    {
      "role": "user",
      "content": "I received my order but one of the items is damaged. What can I do?",
      "turn_number": 1
    },
    {
      "role": "agent",
      "content": "I'm sorry to hear about the damaged item. I'd be happy to help you resolve this. Could you please provide your order number so I can look into it?",
      "turn_number": 2
    },
    {
      "role": "user",
      "content": "My order number is 98765.",
      "turn_number": 3
    },
    {
      "role": "agent",
      "content": "Thank you. I've located order 98765. Could you tell me which item was damaged and briefly describe the damage? This will help us process your request quickly.",
      "turn_number": 4
    },
    {
      "role": "user",
      "content": "It's the ceramic vase. It arrived with a crack along the base.",
      "turn_number": 5
    },
    {
      "role": "agent",
      "content": "I understand, and I apologize for the inconvenience. For the ceramic vase with the cracked base, I can offer you either a full replacement or a refund. Which would you prefer?",
      "turn_number": 6
    },
    {
      "role": "user",
      "content": "A replacement would be great.",
      "turn_number": 7
    },
    {
      "role": "agent",
      "content": "Done! I've scheduled a replacement ceramic vase to be shipped to you. You should receive it within 3-5 business days. You don't need to return the damaged one. Is there anything else I can help you with?",
      "turn_number": 8
    }
  ],
  "expected_outcome": {
    "task_completed": true,
    "summary": "Customer reported a damaged ceramic vase and a replacement was arranged."
  }
}
